{"schema_version":2,"identity":"acid-rave","series":"Acid Rave","set_name":"Core","brief":{"target_duration_minutes":35,"hard":["lossless","mono-source"],"mixability":["verified"],"narrative":["build","peak"]},"tracks":[{"position":1,"source_id":"djing","track_id":1,"path":"Acid Rave/01 - Acid Signal.flac","role":"opener","source_quality":"lossless","analysis_confidence":1,"mixability_status":"verified"},{"position":2,"source_id":"djing","track_id":2,"path":"Acid Rave/02 - Warehouse Pressure.flac","role":"development","source_quality":"lossless","analysis_confidence":1,"mixability_status":"verified"},{"position":3,"source_id":"djing","track_id":3,"path":"Acid Rave/03 - 303 Finale.flac","role":"peak","source_quality":"lossless","analysis_confidence":1,"mixability_status":"verified"}],"transitions":[{"from_path":"Acid Rave/01 - Acid Signal.flac","to_path":"Acid Rave/02 - Warehouse Pressure.flac","compatibility":0.9,"confidence":"HIGH","strategy":"STANDARD_BLEND","overlap_bars":16,"outgoing_region":"outro","incoming_region":"intro","target_bpm":130,"from_pitch_percent":0,"to_pitch_percent":0,"bass_handoff":"swap","reasons":["exported BPM"]},{"from_path":"Acid Rave/02 - Warehouse Pressure.flac","to_path":"Acid Rave/03 - 303 Finale.flac","compatibility":0.88,"confidence":"HIGH","strategy":"LATE_BASS_HANDOFF","overlap_bars":16,"outgoing_region":"outro","incoming_region":"intro","target_bpm":132,"from_pitch_percent":0,"to_pitch_percent":0,"bass_handoff":"swap","reasons":["exported BPM"]}],"alternatives":[{"source_id":"djing","track_id":4,"path":"Acid Rave/04 - Dawn Exit.flac","role":"alternative","replace_position":3,"entry_from_path":"Acid Rave/02 - Warehouse Pressure.flac","entry_compatibility":0.8,"entry_strategy":"STANDARD_BLEND","rejoin_to_path":"Acid Rave/03 - 303 Finale.flac","exit_compatibility":0.8,"exit_strategy":"LATE_BASS_HANDOFF"}],"validation":{"core_tracks":3,"alternative_tracks":1,"availability_verified":3,"analysis_available":3,"lossless_tracks":3,"core_transitions_validated":2,"lowest_transition_compatibility":0.88,"unverified_transitions":0,"hard_constraints_violated":0}}
