{"schema_version":2,"identity":"acid-rave","series":"Acid Rave","set_name":"Baseline","brief":{"target_duration_minutes":35,"hard":["lossless"],"mixability":[],"narrative":["build"]},"tracks":[{"position":1,"source_id":"djing","track_id":1,"path":"Acid Rave/01 - Acid Signal.flac","role":"opener","source_quality":"lossless","analysis_confidence":1,"mixability_status":"verified"},{"position":2,"source_id":"djing","track_id":1,"path":"Acid Rave/01 - Acid Signal.flac","role":"peak","source_quality":"lossless","analysis_confidence":1,"mixability_status":"verified"},{"position":3,"source_id":"djing","track_id":1,"path":"Acid Rave/01 - Acid Signal.flac","role":"peak","source_quality":"lossless","analysis_confidence":1,"mixability_status":"verified"}],"transitions":[{"from_path":"Acid Rave/01 - Acid Signal.flac","to_path":"Acid Rave/01 - Acid Signal.flac","compatibility":1,"confidence":"HIGH","strategy":"STANDARD_BLEND","overlap_bars":16,"outgoing_region":"outro","incoming_region":"intro","target_bpm":136,"from_pitch_percent":0,"to_pitch_percent":0,"bass_handoff":"swap","reasons":["invented"]},{"from_path":"Acid Rave/01 - Acid Signal.flac","to_path":"Acid Rave/01 - Acid Signal.flac","compatibility":1,"confidence":"HIGH","strategy":"STANDARD_BLEND","overlap_bars":16,"outgoing_region":"outro","incoming_region":"intro","target_bpm":136,"from_pitch_percent":0,"to_pitch_percent":0,"bass_handoff":"swap","reasons":["invented"]}],"alternatives":[],"validation":{"core_tracks":3,"alternative_tracks":0,"availability_verified":3,"analysis_available":3,"lossless_tracks":3,"core_transitions_validated":2,"lowest_transition_compatibility":1,"unverified_transitions":0,"hard_constraints_violated":0}}
