{"schema_version":2,"identity":"adversarial","series":"Adversarial","set_name":"Baseline refusal","brief":{"target_duration_minutes":20,"hard":["available"],"mixability":[],"narrative":["uncertain"]},"tracks":[{"position":1,"source_id":"djing","track_id":10,"path":"Safe/Fallback.flac","role":"refused","source_quality":"unknown","analysis_confidence":null,"mixability_status":"unverified"}],"transitions":[],"alternatives":[],"validation":{"core_tracks":1,"alternative_tracks":0,"availability_verified":1,"analysis_available":0,"lossless_tracks":0,"core_transitions_validated":0,"lowest_transition_compatibility":null,"unverified_transitions":0,"hard_constraints_violated":0}}
